{
  "$schema": "http://json-schema.org/draft-07/schema#",
  "type": "object",
  "required": ["module_id", "module_name", "phase_id", "estimated_hours", "catchbook_deliverable", "learning_objectives", "lessons"],
  "properties": {
    "module_id": {"type": "string", "pattern": "^P[0-9]{2}-M[0-9]{2}$"},
    "module_name": {"type": "string"},
    "phase_id": {"type": "string", "pattern": "^P[0-9]{2}$"},
    "estimated_hours": {"type": "integer", "minimum": 1},
    "catchbook_deliverable": {"type": "string"},
    "description": {"type": "string"},
    "prerequisites": {
      "type": "array",
      "items": {"type": "string", "pattern": "^P[0-9]{2}-M[0-9]{2}$"}
    },
    "learning_objectives": {
      "type": "array",
      "items": {"type": "string"},
      "minItems": 1
    },
    "skills_taught": {
      "type": "array",
      "items": {"type": "string"}
    },
    "lessons": {
      "type": "array",
      "items": {
        "type": "object",
        "required": ["lesson_id", "title", "estimated_minutes"],
        "properties": {
          "lesson_id": {"type": "string", "pattern": "^P[0-9]{2}-M[0-9]{2}-L[0-9]{2}$"},
          "title": {"type": "string"},
          "lesson_type": {"type": "string", "enum": ["conceptual", "hands-on", "project", "review"]},
          "estimated_minutes": {"type": "integer", "minimum": 15}
        }
      }
    },
    "catchbook_integration": {
      "type": "object",
      "properties": {
        "feature_area": {"type": "string"},
        "repository_path": {"type": "string"},
        "dependencies": {"type": "array", "items": {"type": "string"}}
      }
    },
    "resources": {
      "type": "array",
      "items": {
        "type": "object",
        "required": ["type", "title", "url"],
        "properties": {
          "type": {"type": "string"},
          "title": {"type": "string"},
          "url": {"type": "string", "format": "uri"}
        }
      }
    },
    "metadata": {
      "type": "object",
      "required": ["created_at", "updated_at"],
      "properties": {
        "created_at": {"type": "string", "format": "date"},
        "updated_at": {"type": "string", "format": "date"},
        "generated_by": {"type": "string"}
      }
    }
  }
}