{
  "module_id": "P21-M06",
  "module_name": "Claude Code in CI/CD pipelines",
  "phase_id": "P21",
  "estimated_hours": 10,
  "catchbook_deliverable": "CI pipeline with Claude Code automated code review",
  "description": "Integrate Claude Code into production CI/CD workflows for automated code review, batch refactoring, and migration assistance. Build GitHub Actions workflows that leverage Claude Code for quality assurance, implement cost monitoring strategies, and establish best practices for AI-assisted code review in team environments.",
  "prerequisites": ["P21-M05", "P15-M05"],
  "learning_objectives": [
    "Integrate Claude Code into GitHub Actions CI/CD pipelines",
    "Automate code review using Claude Code in pull request workflows",
    "Implement batch processing for large-scale refactors and migrations",
    "Build cost monitoring and budget controls for CI-based AI usage",
    "Design fail-safe mechanisms for AI-assisted CI processes",
    "Apply Claude Code to automated documentation generation",
    "Optimize Claude Code performance in containerized CI environments"
  ],
  "skills_taught": [
    "GitHub Actions workflow configuration with AI tools",
    "Claude Code automation in CI/CD contexts",
    "Batch processing and parallel execution strategies",
    "Cost monitoring and budget enforcement",
    "Automated code review implementation",
    "Docker integration for Claude Code in CI",
    "Error handling and fallback strategies for AI tools"
  ],
  "lessons": [
    {
      "lesson_id": "P21-M06-L01",
      "title": "Claude Code in GitHub Actions: setup and authentication",
      "lesson_type": "hands-on",
      "estimated_minutes": 90
    },
    {
      "lesson_id": "P21-M06-L02",
      "title": "Automated code review workflow for pull requests",
      "lesson_type": "hands-on",
      "estimated_minutes": 105
    },
    {
      "lesson_id": "P21-M06-L03",
      "title": "Batch processing: migrations and large-scale refactors",
      "lesson_type": "hands-on",
      "estimated_minutes": 90
    },
    {
      "lesson_id": "P21-M06-L04",
      "title": "Cost monitoring and optimization in CI/CD",
      "lesson_type": "conceptual",
      "estimated_minutes": 75
    },
    {
      "lesson_id": "P21-M06-L05",
      "title": "Fail-safe mechanisms and error handling",
      "lesson_type": "hands-on",
      "estimated_minutes": 60
    },
    {
      "lesson_id": "P21-M06-L06",
      "title": "Project: complete CI pipeline with AI code review",
      "lesson_type": "project",
      "estimated_minutes": 120
    }
  ],
  "catchbook_integration": {
    "feature_area": "CI/CD Infrastructure",
    "repository_path": ".github/workflows/claude-review.yml, scripts/batch-refactor.sh, monitoring/ai-costs.json",
    "dependencies": [
      "claude-code (CLI)",
      "github-actions",
      "docker",
      "prometheus (for cost monitoring)"
    ]
  },
  "resources": [
    {
      "type": "documentation",
      "title": "GitHub Actions Documentation",
      "url": "https://docs.github.com/en/actions"
    },
    {
      "type": "documentation",
      "title": "Claude Code CI/CD Integration",
      "url": "https://docs.claude.com/claude-code/cicd"
    },
    {
      "type": "guide",
      "title": "Automated Code Review Best Practices",
      "url": "https://github.blog/2023-04-11-automated-code-review-best-practices/"
    },
    {
      "type": "tutorial",
      "title": "Docker in GitHub Actions",
      "url": "https://docs.docker.com/ci-cd/github-actions/"
    },
    {
      "type": "reference",
      "title": "AI Cost Monitoring Strategies",
      "url": "https://www.anthropic.com/research/cost-optimization"
    }
  ],
  "metadata": {
    "created_at": "2025-12-06",
    "updated_at": "2025-12-06",
    "generated_by": "Claude (Curriculum Designer)"
  }
}
