{
  "module_id": "P02-M01",
  "module_name": "Development tools: ESLint, Prettier, hooks, Claude Code",
  "phase_id": "P02",
  "estimated_hours": 10,
  "catchbook_deliverable": "Claude Code configured for Catchbook project with CLAUDE.md context",
  "description": "Establish professional development environment with automated code quality tools and AI-assisted development workflows. Integrate ESLint, Prettier, pre-commit hooks, and Claude Code CLI to create a robust, efficient development setup for the Catchbook project.",
  "prerequisites": ["P01-M04"],
  "learning_objectives": [
    "Configure ESLint for JavaScript/TypeScript code quality enforcement",
    "Set up Prettier for consistent code formatting across the project",
    "Implement pre-commit hooks using Husky to automate quality checks",
    "Install and configure Claude Code CLI for AI-assisted development",
    "Create comprehensive CLAUDE.md project context file for optimal AI assistance",
    "Integrate Claude Code commands into daily development workflow",
    "Apply automated tooling to Catchbook repository for professional standards"
  ],
  "skills_taught": [
    "ESLint configuration and rule customization",
    "Prettier integration with editors and build tools",
    "Git hooks with Husky and lint-staged",
    "Claude Code CLI installation and setup",
    "AI context management with CLAUDE.md",
    "Tool automation and workflow optimization"
  ],
  "lessons": [
    {
      "lesson_id": "P02-M01-L01",
      "title": "ESLint fundamentals and Catchbook configuration",
      "lesson_type": "hands-on",
      "estimated_minutes": 90
    },
    {
      "lesson_id": "P02-M01-L02",
      "title": "Prettier setup and editor integration",
      "lesson_type": "hands-on",
      "estimated_minutes": 75
    },
    {
      "lesson_id": "P02-M01-L03",
      "title": "Pre-commit hooks with Husky and lint-staged",
      "lesson_type": "hands-on",
      "estimated_minutes": 90
    },
    {
      "lesson_id": "P02-M01-L04",
      "title": "Claude Code CLI: installation and basic commands",
      "lesson_type": "hands-on",
      "estimated_minutes": 90
    },
    {
      "lesson_id": "P02-M01-L05",
      "title": "CLAUDE.md: project context for AI assistance",
      "lesson_type": "project",
      "estimated_minutes": 105
    },
    {
      "lesson_id": "P02-M01-L06",
      "title": "Integrating all tools: complete Catchbook dev workflow",
      "lesson_type": "project",
      "estimated_minutes": 90
    }
  ],
  "catchbook_integration": {
    "feature_area": "Development Infrastructure",
    "repository_path": ".eslintrc.js, .prettierrc, .husky/, CLAUDE.md",
    "dependencies": [
      "eslint@^8.x",
      "prettier@^3.x",
      "husky@^8.x",
      "lint-staged@^15.x",
      "claude-code (CLI)"
    ]
  },
  "resources": [
    {
      "type": "documentation",
      "title": "ESLint Getting Started",
      "url": "https://eslint.org/docs/latest/use/getting-started"
    },
    {
      "type": "documentation",
      "title": "Prettier Documentation",
      "url": "https://prettier.io/docs/en/"
    },
    {
      "type": "documentation",
      "title": "Husky Git Hooks",
      "url": "https://typicode.github.io/husky/"
    },
    {
      "type": "documentation",
      "title": "Claude Code CLI Documentation",
      "url": "https://docs.claude.com/claude-code"
    },
    {
      "type": "guide",
      "title": "Airbnb JavaScript Style Guide",
      "url": "https://github.com/airbnb/javascript"
    }
  ],
  "metadata": {
    "created_at": "2025-12-06",
    "updated_at": "2025-12-06",
    "generated_by": "Claude (Curriculum Designer)"
  }
}
